{
  "schema_version": 1,
  "classifications": [
    "control",
    "historical-baseline",
    "valid-treatment",
    "invalid-infrastructure",
    "delivery-unproven",
    "probe",
    "excluded"
  ],
  "arm_policies": [
    "docs/validation/PI-DADDY-ARM.v1.json"
  ],
  "results": [
    {
      "path": "architect/tests/results/pi-fireworks-accounts-fireworks-models-deepseek-v4-pro/2026-07-02T15-30-48-159Z/results.yaml",
      "result_file_sha256": "9091fbd06f00d3b1e8053b6ef24c7c087802643356635f5be3b6f2917078c82e",
      "classification": "historical-baseline",
      "evidence_basis": "historical-treatment",
      "participates": {
        "efficacy": true,
        "stability": true,
        "release_claims": false
      },
      "reason": "Historical v2.4 treatment baseline; it does not measure the v3 prompts and is not current treatment evidence."
    },
    {
      "path": "architect/tests/results/pi-fireworks-accounts-fireworks-models-deepseek-v4-pro/2026-07-02T23-01-01-595Z/results.yaml",
      "result_file_sha256": "e4743020465ccab55bec4f51d84278e19f8e68691addabb7bc0a3b0399aba1d0",
      "classification": "historical-baseline",
      "evidence_basis": "historical-treatment",
      "participates": {
        "efficacy": true,
        "stability": true,
        "release_claims": false
      },
      "reason": "Historical v2.4 treatment baseline; it does not measure the v3 prompts and is not current treatment evidence."
    },
    {
      "path": "architect/tests/results/pi-fireworks-accounts-fireworks-models-deepseek-v4-pro/2026-07-03T07-39-27-263Z/results.yaml",
      "result_file_sha256": "2d981e698c7ab19abec59cb6c907b18b864eb86f88f91978120a411faa16371c",
      "classification": "historical-baseline",
      "evidence_basis": "historical-treatment",
      "participates": {
        "efficacy": true,
        "stability": true,
        "release_claims": false
      },
      "reason": "Historical v2.4 treatment baseline; it does not measure the v3 prompts and is not current treatment evidence."
    },
    {
      "path": "architect/tests/results/pi-fireworks-accounts-fireworks-models-deepseek-v4-pro/2026-07-03T23-54-54-029Z/results.yaml",
      "result_file_sha256": "51889449639e16354e116d22036481c042bb2d3e81580f93405b398026a01c57",
      "classification": "historical-baseline",
      "evidence_basis": "historical-treatment",
      "participates": {
        "efficacy": true,
        "stability": true,
        "release_claims": false
      },
      "reason": "Historical v2.4 treatment baseline; it does not measure the v3 prompts and is not current treatment evidence."
    },
    {
      "path": "architect/tests/results/pi-fireworks-accounts-fireworks-models-deepseek-v4-pro/2026-07-04T18-38-23-847Z/results.yaml",
      "result_file_sha256": "b604af17a103215c33801b9e379a31843c5921fb9a685fdb043d2137fe28fdbe",
      "classification": "historical-baseline",
      "evidence_basis": "historical-treatment",
      "participates": {
        "efficacy": true,
        "stability": true,
        "release_claims": false
      },
      "reason": "Historical v2.4 treatment baseline; it does not measure the v3 prompts and is not current treatment evidence."
    },
    {
      "path": "architect/tests/results/pi-fireworks-accounts-fireworks-models-deepseek-v4-pro/2026-08-03T15-32-52-785Z/results.yaml",
      "result_file_sha256": "735cb92746b200ad90b28734bc831e87c862349e0a1c753a6efd08821f11db6e",
      "classification": "historical-baseline",
      "evidence_basis": "historical-treatment",
      "participates": {
        "efficacy": true,
        "stability": true,
        "release_claims": true
      },
      "reason": "Historical v2.4 treatment baseline; it does not measure the v3 prompts and is not current treatment evidence."
    },
    {
      "path": "architect/tests/results/pi-fireworks-accounts-fireworks-models-deepseek-v4-pro/2026-08-05T08-31-59-847Z/results.yaml",
      "result_file_sha256": "bf3198506709e5886694c865e73e919fe35c223a0cd0d5c4f10efc23ec6ec5a2",
      "classification": "invalid-infrastructure",
      "evidence_basis": "invalid-infrastructure",
      "participates": {
        "efficacy": false,
        "stability": false,
        "release_claims": false
      },
      "reason": "Pi 0.83 progressive-disclosure incident delivered a mostly naked model under a treatment label."
    },
    {
      "path": "architect/tests/results/pi-fireworks-accounts-fireworks-models-deepseek-v4-pro/2026-08-05T08-49-24-985Z/results.yaml",
      "result_file_sha256": "54b259a65ec5224a7e70df30a87b39c63deec861ca83126e862a862950e8ca07",
      "classification": "invalid-infrastructure",
      "evidence_basis": "invalid-infrastructure",
      "participates": {
        "efficacy": false,
        "stability": false,
        "release_claims": false
      },
      "reason": "Pi 0.83 progressive-disclosure incident delivered a mostly naked model under a treatment label."
    },
    {
      "path": "architect/tests/results/pi-fireworks-accounts-fireworks-models-deepseek-v4-pro/2026-08-05T12-32-29-360Z/results.yaml",
      "result_file_sha256": "1a71e75c18bd14e5ee277e5e5038ca76bcf355d0f88dc575fe4229c0486f12b2",
      "classification": "historical-baseline",
      "evidence_basis": "historical-treatment",
      "participates": {
        "efficacy": true,
        "stability": true,
        "release_claims": true
      },
      "reason": "Historical v2.4 treatment baseline; it does not measure the v3 prompts and is not current treatment evidence."
    },
    {
      "path": "architect/tests/results/pi-fireworks-accounts-fireworks-models-deepseek-v4-pro/2026-08-06T10-13-06-589Z/results.yaml",
      "result_file_sha256": "63f7e5b3aa55e7b6d50a0250fce2e1e49eefe729777e0842e7c2bc4eaf5cf4aa",
      "classification": "control",
      "evidence_basis": "historical-control",
      "participates": {
        "efficacy": true,
        "stability": true,
        "release_claims": false
      },
      "reason": "Historical no-skill control; usable only with a compatible historical treatment epoch, never as a treatment score."
    },
    {
      "path": "architect/tests/results/pi-fireworks-accounts-fireworks-models-deepseek-v4-pro/2026-08-08T23-08-52-574Z/results.yaml",
      "result_file_sha256": "83fc4b01dca83fc6ec8326d3abfafbd5e474d81a3801a461bade87830002f4fc",
      "classification": "historical-baseline",
      "evidence_basis": "historical-treatment",
      "participates": {
        "efficacy": true,
        "stability": true,
        "release_claims": true
      },
      "reason": "Historical v2.4 treatment baseline; it does not measure the v3 prompts and is not current treatment evidence."
    },
    {
      "path": "architect/tests/results/pi-fireworks-accounts-fireworks-models-glm-5p2/2026-07-02T23-55-46-093Z/results.yaml",
      "result_file_sha256": "27dd476b0a97ff503f79e0543837a7eeb84561ed7bb05227fa7b3ebe6efdc844",
      "classification": "historical-baseline",
      "evidence_basis": "historical-treatment",
      "participates": {
        "efficacy": true,
        "stability": true,
        "release_claims": false
      },
      "reason": "Historical v2.4 treatment baseline; it does not measure the v3 prompts and is not current treatment evidence."
    },
    {
      "path": "architect/tests/results/pi-fireworks-accounts-fireworks-models-glm-5p2/2026-07-03T08-34-25-073Z/results.yaml",
      "result_file_sha256": "f6c90985393c4df01d9371a23fc21bfb7d775bc7a16988bad547b4e75298decf",
      "classification": "historical-baseline",
      "evidence_basis": "historical-treatment",
      "participates": {
        "efficacy": true,
        "stability": true,
        "release_claims": false
      },
      "reason": "Historical v2.4 treatment baseline; it does not measure the v3 prompts and is not current treatment evidence."
    },
    {
      "path": "architect/tests/results/pi-fireworks-accounts-fireworks-models-glm-5p2/2026-07-04T23-57-13-285Z/results.yaml",
      "result_file_sha256": "298f151a8088ff9d04104cc70614f53a8813c34a5c38fab98abdef45a3aa5b5c",
      "classification": "historical-baseline",
      "evidence_basis": "historical-treatment",
      "participates": {
        "efficacy": true,
        "stability": true,
        "release_claims": false
      },
      "reason": "Historical v2.4 treatment baseline; it does not measure the v3 prompts and is not current treatment evidence."
    },
    {
      "path": "architect/tests/results/pi-fireworks-accounts-fireworks-models-glm-5p2/2026-08-04T08-55-00-434Z/results.yaml",
      "result_file_sha256": "17ead9cc60718e8531f4ba4eba97d50b76ecee3889522c1629a3d99f8df94456",
      "classification": "historical-baseline",
      "evidence_basis": "historical-treatment",
      "participates": {
        "efficacy": true,
        "stability": true,
        "release_claims": true
      },
      "reason": "Historical v2.4 treatment baseline; it does not measure the v3 prompts and is not current treatment evidence."
    },
    {
      "path": "architect/tests/results/pi-fireworks-accounts-fireworks-models-glm-5p2/2026-08-05T08-25-19-214Z/results.yaml",
      "result_file_sha256": "6b1c9da2ac2fc7447ae790b359b7e54b80a630072fb25a48e533dba1f357708a",
      "classification": "invalid-infrastructure",
      "evidence_basis": "invalid-infrastructure",
      "participates": {
        "efficacy": false,
        "stability": false,
        "release_claims": false
      },
      "reason": "Pi 0.83 progressive-disclosure incident delivered a mostly naked model under a treatment label."
    },
    {
      "path": "architect/tests/results/pi-fireworks-accounts-fireworks-models-glm-5p2/2026-08-05T08-52-54-785Z/results.yaml",
      "result_file_sha256": "d1f92de618b9d2eb9025c4dcd1d5076e2ce58d61af257bb7c33cdbe724948805",
      "classification": "invalid-infrastructure",
      "evidence_basis": "invalid-infrastructure",
      "participates": {
        "efficacy": false,
        "stability": false,
        "release_claims": false